{
  "assets": {},
  "clientId": "fixture",
  "clock": 11,
  "createdAt": 0,
  "formatVersion": 1,
  "id": "fixture-layout",
  "name": "layout",
  "nodes": {
    "2-fixture": {
      "children": [
        "3-fixture",
        "6-fixture",
        "B-fixture"
      ],
      "exports": [
        {
          "format": "png",
          "scale": "2x"
        }
      ],
      "id": "2-fixture",
      "locked": false,
      "name": "Layout",
      "parentId": "root_p-1-fixture",
      "styles": {
        "backgroundColor": "#fff8ed",
        "display": "flex",
        "flexDirection": "column",
        "gap": "16px",
        "height": "260px",
        "left": 0,
        "overflow": "hidden",
        "padding": "24px",
        "position": "absolute",
        "top": 0,
        "width": "400px"
      },
      "type": "Frame",
      "visible": true
    },
    "3-fixture": {
      "children": [
        "4-fixture",
        "5-fixture"
      ],
      "id": "3-fixture",
      "locked": false,
      "name": "Frame",
      "parentId": "2-fixture",
      "styles": {
        "alignItems": "center",
        "display": "flex",
        "gap": "12px"
      },
      "type": "Frame",
      "visible": true
    },
    "4-fixture": {
      "children": [],
      "id": "4-fixture",
      "locked": false,
      "name": "Rectangle",
      "parentId": "3-fixture",
      "styles": {
        "backgroundColor": "#eb5b21",
        "borderRadius": "8px",
        "height": "32px",
        "width": "32px"
      },
      "type": "Rectangle",
      "visible": true
    },
    "5-fixture": {
      "children": [],
      "id": "5-fixture",
      "locked": false,
      "name": "OpenCrease",
      "parentId": "3-fixture",
      "styles": {
        "color": "#352214",
        "fontFamily": "Geist Variable",
        "fontSize": "20px",
        "fontWeight": 650
      },
      "text": "OpenCrease",
      "type": "Text",
      "visible": true
    },
    "6-fixture": {
      "children": [
        "7-fixture",
        "8-fixture"
      ],
      "id": "6-fixture",
      "locked": false,
      "name": "Frame",
      "parentId": "2-fixture",
      "styles": {
        "display": "flex",
        "flex": 1,
        "gap": "12px"
      },
      "type": "Frame",
      "visible": true
    },
    "7-fixture": {
      "children": [],
      "id": "7-fixture",
      "locked": false,
      "name": "Rectangle",
      "parentId": "6-fixture",
      "styles": {
        "backgroundImage": "linear-gradient(135deg,#f4b677,#eb5b21)",
        "borderRadius": "12px",
        "flex": 1
      },
      "type": "Rectangle",
      "visible": true
    },
    "8-fixture": {
      "children": [
        "9-fixture",
        "A-fixture"
      ],
      "id": "8-fixture",
      "locked": false,
      "name": "Frame",
      "parentId": "6-fixture",
      "styles": {
        "display": "flex",
        "flex": 1,
        "flexDirection": "column",
        "gap": "8px"
      },
      "type": "Frame",
      "visible": true
    },
    "9-fixture": {
      "children": [],
      "id": "9-fixture",
      "locked": false,
      "name": "Rectangle",
      "parentId": "8-fixture",
      "styles": {
        "backgroundColor": "#ffecce",
        "border": "2px solid #352214",
        "borderRadius": "8px",
        "height": "46px"
      },
      "type": "Rectangle",
      "visible": true
    },
    "A-fixture": {
      "children": [],
      "id": "A-fixture",
      "locked": false,
      "name": "Rectangle",
      "parentId": "8-fixture",
      "styles": {
        "backgroundColor": "#352214",
        "borderRadius": "8px",
        "height": "46px"
      },
      "type": "Rectangle",
      "visible": true
    },
    "B-fixture": {
      "children": [],
      "id": "B-fixture",
      "locked": false,
      "name": "Real HTML. Precise exports.",
      "parentId": "2-fixture",
      "styles": {
        "color": "#69432a",
        "fontFamily": "Geist Variable",
        "fontSize": "12px"
      },
      "text": "Real HTML. Precise exports.",
      "type": "Text",
      "visible": true
    },
    "root_p-1-fixture": {
      "children": [
        "2-fixture"
      ],
      "id": "root_p-1-fixture",
      "locked": false,
      "name": "Root",
      "parentId": null,
      "styles": {},
      "type": "Root",
      "visible": true
    }
  },
  "pageList": [
    {
      "id": "p-1-fixture",
      "type": "page"
    }
  ],
  "pages": {
    "p-1-fixture": {
      "icon": null,
      "id": "p-1-fixture",
      "name": "Page 1",
      "rootId": "root_p-1-fixture"
    }
  },
  "tokens": [],
  "updatedAt": 0
}
